{
  "specversion": "1.0",
  "id": "00000000-0000-4000-8000-000000000101",
  "source": "taudit",
  "type": "io.taudit.finding.authority_propagation",
  "subject": "tests/fixtures/over-privileged.yml",
  "time": "2026-04-19T00:00:00Z",
  "datacontenttype": "application/json",
  "correlationid": "demo-flow-2026-04-19-001",
  "provenancerepo": "taudit",
  "provenanceproducer": "taudit scan",
  "provenanceversion": "v0-draft",
  "provenancekind": "finding",
  "data": {
    "category": "authority_propagation",
    "severity": "critical",
    "message": "GITHUB_TOKEN propagated to some-org/deploy-action@main across trust boundary",
    "nodes_involved": [0, 1],
    "recommendation": {
      "type": "tsafe_remediation",
      "command": "tsafe exec --ns <scoped-namespace> -- <command>",
      "explanation": "Scope GITHUB_TOKEN to only the steps that need it"
    }
  }
}